{
  "provider": "google",
  "last_updated": "2026-03-14",
  "last_verified": "2026-10-17",
  "source": "https://ai.google.dev/gemini-api/docs/pricing",
  "models": [
    {
      "id": "gemini-3.1-pro-preview",
      "name": "Gemini 3.1 Pro",
      "aliases": [
        "gemini-3.1-pro",
        "models/gemini-3.1-pro-preview",
        "gemini-3.1-pro-preview-customtools"
      ],
      "status": "current",
      "input_cost_per_million": 2,
      "output_cost_per_million": 12,
      "cache_read_input_cost_per_million": 0.2,
      "input_cost_above_200k_per_million": 4,
      "output_cost_above_200k_per_million": 18,
      "context_window": 1048576,
      "max_output_tokens": 65536,
      "supports_vision": true,
      "supports_tools": true,
      "supports_prompt_caching": true,
      "supports_reasoning": true,
      "supports_computer_use": false,
      "capabilities": ["code", "reasoning", "general", "creative", "vision", "search"],
      "knowledge_cutoff": "2025-01-01"
    },
    {
      "id": "gemini-3-pro-preview",
      "name": "Gemini 3 Pro",
      "aliases": ["gemini-3-pro", "models/gemini-3-pro-preview"],
      "status": "current",
      "input_cost_per_million": 2,
      "output_cost_per_million": 12,
      "cache_read_input_cost_per_million": 0.2,
      "context_window": 1048576,
      "max_output_tokens": 65535,
      "supports_vision": true,
      "supports_tools": true,
      "supports_prompt_caching": true,
      "supports_reasoning": true,
      "supports_computer_use": false,
      "capabilities": ["code", "reasoning", "general", "creative", "vision", "search"],
      "knowledge_cutoff": "2025-01-01",
      "input_cost_above_200k_per_million": 4,
      "output_cost_above_200k_per_million": 18
    },
    {
      "id": "gemini-3-flash-preview",
      "name": "Gemini 3 Flash",
      "aliases": ["gemini-3-flash", "models/gemini-3-flash-preview"],
      "status": "current",
      "input_cost_per_million": 0.5,
      "output_cost_per_million": 3,
      "cache_read_input_cost_per_million": 0.05,
      "context_window": 1048576,
      "max_output_tokens": 65536,
      "supports_vision": true,
      "supports_tools": true,
      "supports_prompt_caching": true,
      "supports_reasoning": true,
      "supports_computer_use": false,
      "capabilities": ["code", "reasoning", "general", "vision", "search"],
      "knowledge_cutoff": "2025-01-01"
    },
    {
      "id": "gemini-3.1-flash-lite-preview",
      "name": "Gemini 3.1 Flash-Lite",
      "aliases": ["gemini-3.1-flash-lite", "models/gemini-3.1-flash-lite-preview"],
      "status": "current",
      "input_cost_per_million": 0.25,
      "output_cost_per_million": 1.5,
      "cache_read_input_cost_per_million": 0.025,
      "context_window": 1048576,
      "max_output_tokens": 65536,
      "supports_vision": true,
      "supports_tools": true,
      "supports_prompt_caching": true,
      "supports_reasoning": true,
      "supports_computer_use": false,
      "capabilities": ["code", "general", "vision"],
      "knowledge_cutoff": "2025-01-01"
    },
    {
      "id": "gemini-2.5-flash-lite",
      "name": "Gemini 2.5 Flash-Lite",
      "aliases": [
        "models/gemini-2.5-flash-lite",
        "gemini/gemini-2.5-flash-lite",
        "gemini-2.5-flash-lite-preview-06-17",
        "gemini-2.5-flash-lite-preview-09-2025"
      ],
      "status": "current",
      "input_cost_per_million": 0.1,
      "output_cost_per_million": 0.4,
      "cache_read_input_cost_per_million": 0.01,
      "context_window": 1048576,
      "max_output_tokens": 65536,
      "supports_vision": true,
      "supports_tools": true,
      "supports_prompt_caching": true,
      "supports_reasoning": true,
      "supports_computer_use": false,
      "capabilities": ["code", "general", "vision"]
    },
    {
      "id": "gemini-2.5-pro",
      "name": "Gemini 2.5 Pro",
      "aliases": [
        "gemini-2.5-pro-preview",
        "models/gemini-2.5-pro",
        "gemini/gemini-2.5-pro",
        "gemini-2.5-pro-preview-03-25",
        "gemini-2.5-pro-preview-05-06",
        "gemini-2.5-pro-preview-06-05"
      ],
      "status": "legacy",
      "input_cost_per_million": 1.25,
      "output_cost_per_million": 10,
      "cache_read_input_cost_per_million": 0.125,
      "input_cost_above_200k_per_million": 2.5,
      "output_cost_above_200k_per_million": 15,
      "context_window": 1048576,
      "max_output_tokens": 65536,
      "supports_vision": true,
      "supports_tools": true,
      "supports_prompt_caching": true,
      "supports_reasoning": true,
      "supports_computer_use": false,
      "capabilities": ["code", "reasoning", "general", "creative", "vision"]
    },
    {
      "id": "gemini-2.5-flash",
      "name": "Gemini 2.5 Flash",
      "aliases": [
        "gemini-2.5-flash-preview",
        "models/gemini-2.5-flash",
        "gemini/gemini-2.5-flash",
        "gemini-2.5-flash-preview-05-20",
        "gemini-2.5-flash-preview-09-2025"
      ],
      "status": "legacy",
      "input_cost_per_million": 0.3,
      "output_cost_per_million": 2.5,
      "cache_read_input_cost_per_million": 0.03,
      "context_window": 1048576,
      "max_output_tokens": 65536,
      "supports_vision": true,
      "supports_tools": true,
      "supports_prompt_caching": true,
      "supports_reasoning": true,
      "supports_computer_use": false,
      "capabilities": ["code", "general", "vision", "reasoning"]
    },
    {
      "id": "gemini-2.0-flash",
      "name": "Gemini 2.0 Flash",
      "aliases": [
        "gemini-2.0-flash-001",
        "models/gemini-2.0-flash",
        "gemini/gemini-2.0-flash",
        "gemini-2.0-flash-preview-image-generation"
      ],
      "status": "current",
      "input_cost_per_million": 0.1,
      "output_cost_per_million": 0.4,
      "cache_read_input_cost_per_million": 0.025,
      "context_window": 1048576,
      "max_output_tokens": 8192,
      "supports_vision": true,
      "supports_tools": true,
      "supports_prompt_caching": true,
      "supports_reasoning": false,
      "supports_computer_use": false,
      "capabilities": ["code", "general", "vision"]
    },
    {
      "id": "gemini-2.0-flash-lite",
      "name": "Gemini 2.0 Flash Lite",
      "aliases": [
        "models/gemini-2.0-flash-lite",
        "gemini/gemini-2.0-flash-lite",
        "gemini-2.0-flash-lite-001",
        "gemini-2.0-flash-lite-preview-02-05"
      ],
      "status": "current",
      "input_cost_per_million": 0.075,
      "output_cost_per_million": 0.3,
      "context_window": 1048576,
      "max_output_tokens": 8192,
      "supports_vision": true,
      "supports_tools": true,
      "supports_prompt_caching": true,
      "supports_reasoning": false,
      "supports_computer_use": false,
      "capabilities": ["code", "general", "vision"],
      "cache_read_input_cost_per_million": 0.0188
    },
    {
      "id": "gemini-1.5-pro",
      "name": "Gemini 1.5 Pro",
      "aliases": [
        "gemini-1.5-pro-002",
        "gemini-1.5-pro-001",
        "models/gemini-1.5-pro",
        "gemini/gemini-1.5-pro",
        "gemini-1.5-pro-latest",
        "gemini-1.5-pro-exp-0801"
      ],
      "status": "legacy",
      "input_cost_per_million": 3.5,
      "output_cost_per_million": 10.5,
      "cache_read_input_cost_per_million": 0.3125,
      "input_cost_above_200k_per_million": 2.5,
      "output_cost_above_200k_per_million": 10,
      "context_window": 2097152,
      "max_output_tokens": 8192,
      "supports_vision": true,
      "supports_tools": true,
      "supports_prompt_caching": true,
      "supports_reasoning": false,
      "supports_computer_use": false,
      "capabilities": ["code", "reasoning", "general", "creative", "vision"]
    },
    {
      "id": "gemini-1.5-flash",
      "name": "Gemini 1.5 Flash",
      "aliases": [
        "gemini-1.5-flash-002",
        "gemini-1.5-flash-001",
        "models/gemini-1.5-flash",
        "gemini/gemini-1.5-flash",
        "gemini-1.5-flash-latest"
      ],
      "status": "legacy",
      "input_cost_per_million": 0.075,
      "output_cost_per_million": 0.3,
      "cache_read_input_cost_per_million": 0.01875,
      "context_window": 1048576,
      "max_output_tokens": 8192,
      "supports_vision": true,
      "supports_tools": true,
      "supports_prompt_caching": true,
      "supports_reasoning": false,
      "supports_computer_use": false,
      "capabilities": ["code", "general", "vision"]
    }
  ]
}
