{
  "provider": "xai",
  "last_updated": "2026-08-30",
  "last_verified": "2026-10-27",
  "source": "https://docs.x.ai/docs/models",
  "models": [
    {
      "id": "grok-3",
      "name": "Grok 3",
      "aliases": ["xai/grok-3", "grok-3-beta", "grok-3-latest"],
      "status": "current",
      "input_cost_per_million": 1.25,
      "output_cost_per_million": 2.5,
      "cache_read_input_cost_per_million": 0.2,
      "batch_input_cost_per_million": 1.5,
      "batch_output_cost_per_million": 7.5,
      "context_window": 131072,
      "max_output_tokens": 131072,
      "supports_vision": false,
      "supports_tools": true,
      "supports_prompt_caching": true,
      "supports_reasoning": false,
      "supports_computer_use": false,
      "capabilities": ["code", "reasoning", "general", "creative"],
      "input_cost_above_200k_per_million": 2.5,
      "output_cost_above_200k_per_million": 5
    },
    {
      "id": "grok-3-mini",
      "name": "Grok 3 Mini",
      "aliases": ["xai/grok-3-mini", "grok-3-mini-beta", "grok-3-mini-latest"],
      "status": "current",
      "input_cost_per_million": 1.25,
      "output_cost_per_million": 2.5,
      "cache_read_input_cost_per_million": 0.2,
      "batch_input_cost_per_million": 0.15,
      "batch_output_cost_per_million": 0.25,
      "context_window": 131072,
      "max_output_tokens": 131072,
      "supports_vision": false,
      "supports_tools": true,
      "supports_prompt_caching": true,
      "supports_reasoning": true,
      "supports_computer_use": false,
      "capabilities": ["code", "general", "reasoning"],
      "input_cost_above_200k_per_million": 2.5,
      "output_cost_above_200k_per_million": 5
    },
    {
      "id": "grok-3-vision",
      "name": "Grok 3 Vision",
      "aliases": ["xai/grok-3-vision", "grok-vision-beta"],
      "status": "current",
      "input_cost_per_million": 3,
      "output_cost_per_million": 15,
      "cache_read_input_cost_per_million": 0.75,
      "context_window": 32768,
      "max_output_tokens": 16384,
      "supports_vision": true,
      "supports_tools": true,
      "supports_prompt_caching": true,
      "supports_reasoning": false,
      "supports_computer_use": false,
      "capabilities": ["code", "general", "vision"]
    },
    {
      "id": "grok-2",
      "name": "Grok 2",
      "aliases": ["grok-2-1212", "xai/grok-2", "grok-2-latest"],
      "status": "legacy",
      "input_cost_per_million": 2,
      "output_cost_per_million": 10,
      "context_window": 131072,
      "max_output_tokens": 131072,
      "supports_vision": false,
      "supports_tools": true,
      "supports_prompt_caching": false,
      "supports_reasoning": false,
      "supports_computer_use": false,
      "capabilities": ["code", "reasoning", "general"]
    },
    {
      "id": "grok-2-vision",
      "name": "Grok 2 Vision",
      "aliases": ["grok-2-vision-1212", "xai/grok-2-vision", "grok-2-vision-latest"],
      "status": "legacy",
      "input_cost_per_million": 2,
      "output_cost_per_million": 10,
      "context_window": 32768,
      "max_output_tokens": 32768,
      "supports_vision": true,
      "supports_tools": true,
      "supports_prompt_caching": false,
      "supports_reasoning": false,
      "supports_computer_use": false,
      "capabilities": ["code", "general", "vision"]
    },
    {
      "id": "grok-4",
      "name": "Grok 4",
      "aliases": ["xai/grok-4", "grok-4-0709", "grok-4-latest"],
      "status": "current",
      "input_cost_per_million": 1.25,
      "output_cost_per_million": 2.5,
      "context_window": 256000,
      "max_output_tokens": 256000,
      "supports_vision": false,
      "supports_tools": true,
      "supports_prompt_caching": true,
      "supports_reasoning": true,
      "supports_computer_use": false,
      "capabilities": ["code", "reasoning", "general", "creative"],
      "cache_read_input_cost_per_million": 0.2,
      "input_cost_above_200k_per_million": 2.5,
      "output_cost_above_200k_per_million": 5
    },
    {
      "id": "grok-3-fast",
      "name": "Grok 3 Fast",
      "aliases": ["xai/grok-3-fast-beta", "grok-3-fast-beta", "grok-3-fast-latest"],
      "status": "current",
      "input_cost_per_million": 1.25,
      "output_cost_per_million": 2.5,
      "context_window": 131072,
      "max_output_tokens": 131072,
      "supports_vision": false,
      "supports_tools": true,
      "supports_prompt_caching": true,
      "supports_reasoning": false,
      "supports_computer_use": false,
      "capabilities": ["code", "reasoning", "general"],
      "cache_read_input_cost_per_million": 0.2,
      "input_cost_above_200k_per_million": 2.5,
      "output_cost_above_200k_per_million": 5
    },
    {
      "id": "grok-3-mini-fast",
      "name": "Grok 3 Mini Fast",
      "aliases": ["xai/grok-3-mini-fast", "grok-3-mini-fast-beta", "grok-3-mini-fast-latest"],
      "status": "current",
      "input_cost_per_million": 1.25,
      "output_cost_per_million": 2.5,
      "context_window": 131072,
      "max_output_tokens": 131072,
      "supports_vision": false,
      "supports_tools": true,
      "supports_prompt_caching": true,
      "supports_reasoning": true,
      "supports_computer_use": false,
      "capabilities": ["code", "general", "reasoning"],
      "cache_read_input_cost_per_million": 0.2,
      "input_cost_above_200k_per_million": 2.5,
      "output_cost_above_200k_per_million": 5
    },
    {
      "id": "grok-code-fast",
      "name": "Grok Code Fast",
      "aliases": ["xai/grok-code-fast", "grok-code-fast-1", "grok-code-fast-1-0825"],
      "status": "current",
      "input_cost_per_million": 1,
      "output_cost_per_million": 2,
      "context_window": 256000,
      "max_output_tokens": 256000,
      "supports_vision": true,
      "supports_tools": true,
      "supports_prompt_caching": true,
      "supports_reasoning": true,
      "supports_computer_use": false,
      "capabilities": ["code"],
      "cache_read_input_cost_per_million": 0.2,
      "input_cost_above_200k_per_million": 2,
      "output_cost_above_200k_per_million": 4
    },
    {
      "id": "grok-4-fast",
      "name": "Grok 4 Fast",
      "aliases": [
        "xai/grok-4-fast-reasoning",
        "grok-4-fast-reasoning",
        "grok-4-fast-non-reasoning",
        "grok-4-1-fast",
        "grok-4-1-fast-reasoning",
        "grok-4-1-fast-reasoning-latest",
        "grok-4-1-fast-non-reasoning",
        "grok-4-1-fast-non-reasoning-latest"
      ],
      "status": "current",
      "input_cost_per_million": 1.25,
      "output_cost_per_million": 2.5,
      "context_window": 2000000,
      "max_output_tokens": 2000000,
      "supports_vision": false,
      "supports_tools": true,
      "supports_prompt_caching": true,
      "supports_reasoning": true,
      "supports_computer_use": false,
      "capabilities": ["code", "reasoning", "general"],
      "cache_read_input_cost_per_million": 0.2,
      "input_cost_above_200k_per_million": 2.5,
      "output_cost_above_200k_per_million": 5
    }
  ]
}
